Title,Abstract,Subfield,Link,IS_Relevant
Supporting Decision-Making for Promoting Teaching and Learning Innovation: A Multiple Case Study,"The quality of the data and the amount of correct information available is key to informed decision-making. Higher education institutions (HEIs) often employ various decision support systems (DSSs) to make better choices. However, there is a lack of systems to assist with decision-making to promote innovation in teaching and learning. In this study, we evaluate an analytic tool called PROF-XXI that supports strategic decision-making of teaching and learning centres (TLCs) by identifying their competencies in teaching and learning innovation. Through a multiple case study conducted with three Latin American universities and supported by quantitative and qualitative data, we observed how this tool is used and how it facilitates strategic decision-making. Our findings indicate that the tool is accessible, user-friendly, and effective in 1) initiating identification and systematic reflection of institutional competency levels in teaching and learning innovation, 2) enhancing understanding of strengths and weaknesses as well as identifying opportunities for innovation, 3) supporting TLCs with short- and long-term decision-making, and 4) continuously evaluating their strategies, programs, and initiatives. This research can benefit policymakers in higher education who are involved in measuring institutional competencies to improve teaching quality or in making strategic decisions related to teaching and learning innovation.",DSA,https://www.semanticscholar.org/paper/15948c95702424d1ef9e9f7efe7c53a583c503c7,True
Visualizing statistical linked knowledge for decision support,"In a global and interconnected economy, decision makers often need to consider information from various domains. A tourism destination manager, for example, has to correlate tourist behavior with financial and environmental indicators to allocate funds for strategic long-term investments. Statistical data underpins a broad range of such cross-domain decision tasks. A variety of statistical datasets are available as Linked Open Data, often incorporated into visual analytics solutions to support decision making. What are the principles, architectures, workflows and implementation design patterns that should be followed for building such visual cross-domain decision support systems. This article introduces a methodology to integrate and visualize cross-domain statistical data sources by applying selected RDF Data Cube (QB) principles. A visual dashboard built according to this methodology is presented and evaluated in the context of two use cases in the tourism and telecommunications domains.",DSA,https://www.semanticscholar.org/paper/e1a39e23817e481c93afcb2e633a5db7f34c6eff,True
Not seeing the (moral) forest for the trees? How task complexity and employees’ expertise affect moral disengagement with discriminatory data analytics recommendations,"Data analytics provides versatile decision support to help employees tackle the rising complexity of today’s business decisions. Notwithstanding the benefits of these systems, research has shown their potential for provoking discriminatory decisions. While technical causes have been studied, the human side has been mostly neglected, albeit employees mostly still need to decide to turn analytics recommendations into actions. Drawing upon theories of technology dominance and of moral disengagement, we investigate how task complexity and employees’ expertise affect the approval of discriminatory data analytics recommendations. Through two online experiments, we confirm the important role of advantageous comparison, displacement of responsibility, and dehumanization, as the cognitive moral disengagement mechanisms that facilitate such approvals. While task complexity generally enhances these mechanisms, expertise retains a critical role in analytics-supported decision-making processes. Importantly, we find that task complexity’s effects on users’ dehumanization vary: more data subjects increase dehumanization, whereas richer information on subjects has the opposite effect. By identifying the cognitive mechanisms that facilitate approvals of discriminatory data analytics recommendations, this study contributes toward designing tools, methods, and practices that combat unethical consequences of using these systems.",DSA,https://www.semanticscholar.org/paper/316af19ab8f6c08f0331bb6adba18fa0872653d3,True
Decision Guidance Analytics Language (DGAL) - Toward Reusable Knowledge Base Centric Modeling,"Decision guidance systems are a class of decision support systems that are geared toward producing actionable recommendations, typically based on formal analytical models and techniques. This paper proposes the Decision Guidance Analytics Language (DGAL) for easy iterative development of decision guidance systems. DGAL allows the creation of modular, reusable and composable models that are stored in the analytical knowledge base independently of the tasks and tools that use them. Based on these unified models, DGAL supports declarative queries of (1) data manipulation and computation, (2) what-if prediction analysis, (3) deterministic and stochastic decision optimization, and (4) machine learning, all through formal reduction to specialized models and tools, and in the presence of uncertainty.",DSA,https://www.semanticscholar.org/paper/9d2a945e2d9ed847384053188249ecfbe0bd9dee,True
Big Data & Analytics to Support the Renewable Energy Integration of Smart Grids - Case Study: Power Solar Generation,"Smart Grid is the modernization of electrical networks using intelligent systems and information technologies. In smart grid environment, the application of big data analytics based decision support and intelligent control are mainly in the following four aspects: power generation side management, micro grid and renewable energy management, asset management and collaborative operations, and demand side management. The objective of this research is to present a technological infrastructure for the management of large volumes of information through Big Data tools to support the integration of renewable energy. The infrastructure includes a methodological architecture for the acquisition, processing, storage, management, analysis, monitoring and forecast of large amounts of data. The development of a Big Data application for the analysis and monitoring of the information generated by photovoltaic systems is included as a case study. Solar generation technologies have experienced strong energy market growth in the past few years, with corresponding increase in local grid penetration. The goal is to have timely information to make better decisions to improve the integration of renewable energy in the Smart Grid.",DSA,https://www.semanticscholar.org/paper/39f6a97cc3cdcf3601e4dc54a35adde6ac2b6c3a,True
Business Analytics for Decision Making,"Providing decision support for business processes management and decision processes is a crucial but challenging task. Business intelligence and analytics equips analytics experts with the technological capabilities to support decision processes with reliable information and analytic insights, thus potentially raising the quality of managerial decision making. More-so when leveraging e-commerce platforms with rising complex ways of doing business, it is imperative for business organisations to make calculated decisions which are supported by tools in business analytics. This paper provides insights on how e-commerce, supply chain management, human resource management and business process management employ business analytics as an enabler. Additionally, the paper concludes through business analytics initiatives, businesses and organizations gain critical insights from the structured data collected through various enterprise systems and with the emerging trends and new tools in business analytics, more intelligence will be gathered for decision making in fields such as e-government, healthcare, and security.",DSA,https://www.semanticscholar.org/paper/dba5ff9fe86604c096a3fe86d1210f54855579de,True
Operational Analytics Data Management Systems,"Prior to mid-2000s, the space of data analytics was mainly confined within the area of decision support systems. It was a long era of isolated enterprise data ware houses curating information from live data sources and of business intelligence software used to query such information. Most data sets were small enough in volume and static enough invelocity to be segregated in warehouses for analysis. Data analysis was not ad-hoc; it required pre-requisite knowledge of underlying data access patterns for the creation of specialized access methods (e.g. covering indexes, materialized views) in order to efficiently execute a set of few focused queries.",DSA,https://www.semanticscholar.org/paper/712bd29742f8292a9d00c51fd365b586c2c79a2b,True
Explainable Student Agency Analytics,"Several studies have shown that complex nonlinear learning analytics (LA) techniques outperform the traditional ones. However, the actual integration of these techniques in automatic LA systems remains rare because they are generally presumed to be opaque. At the same time, the current reviews on LA in higher education point out that LA should be more grounded to the learning science with actual linkage to teachers and pedagogical planning. In this study, we aim to address these two challenges. First, we discuss different techniques that open up the decision-making process of complex techniques and how they can be integrated in LA tools. More precisely, we present various global and local explainable techniques with an example of an automatic LA process that provides information about different resources that can support student agency in higher education institutes. Second, we exemplify these techniques and the LA process through recently collected student agency data in four courses of the same content taught by four different teachers. Altogether, we demonstrate how this process—which we call explainable student agency analytics—can contribute to teachers’ pedagogical planning through the LA cycle.",DSA,https://www.semanticscholar.org/paper/d823cf50ba80fa50e0ebb0a2caf9eeded2251b9d,True
How Do Small and Medium-Sized Game Companies Use Analytics? An Attention-Based View of Game Analytics,"The widespread adoption of the freemium business model together with the introduction of cost-efficient analytics tools have made the use of analytics pervasive in the game industry. While big data and analytics have drawn extensive scholarly attention, the research focusing particularly on game analytics is scant and largely descriptive. Thus, there is a need for research focusing on how game companies employ analytics. In this study, we analyze data collected through a set of in-depth interviews of small and medium-sized freemium game developers. We identify four main roles of game analytics: 1) sense-making device, 2) decision-support system, 3) communication tool, and 4) hygiene factor. We employ the attention-based view of the firm to discuss how these roles diverge and converge in terms of organizational attention. The study advances the research on the roles and business value of analytics in the game and software industry.",DSA,https://www.semanticscholar.org/paper/67be9fa3b522a1c9515d594aadfa2d1b54eb4f0c,True
Business Analytics in the Context of Big Data: A Roadmap for Research,"This paper builds on academic and industry discussions from the 2012 and 2013 pre-ICIS events: BI Congress III and the Special Interest Group on Decision Support Systems (SIGDSS) workshop, respectively. Recognizing the potential of “big data” to offer new insights for decision making and innovation, panelists at the two events discussed how organizations can use and manage big data for competitive advantage. In addition, expert panelists helped to identify research gaps. While emerging research in the academic community identifies some of the issues in acquiring, analyzing, and using big data, many of the new developments are occurring in the practitioner community. We bridge the gap between academic and practitioner research by presenting a big data analytics framework that depicts a process view of the components needed for big data analytics in organizations. Using practitioner interviews and literature from both academia and practice, we identify the current state of big data research guided by the framework and propose potential areas for future research to increase the relevance of academic research to practice.",DSA,https://www.semanticscholar.org/paper/a0ff514a8a64ba5a7cd7430ca04245fd037d040c,True
Comparing the utility of decision trees and support vector machines when planning inspections of linear sewer infrastructure,"Closed-circuit television inspection technology is traditionally used to identify aging sewer pipes requiring rehabilitation. While these inspections provide essential information on the condition of pipes hidden from day-to-day view, they are expensive and often limited to small portions of an entire sewer system. Municipalities may benefit from utilizing predictive analytics to leverage existing inspection datasets so that reliable predictions of condition are available for pipes that have not yet been inspected. The predictive capabilities of data mining systems, namely support vector machines (SVMs) and decision tree classifiers, are demonstrated using a case study of sanitary sewer pipe inspection data collected by the municipality of Guelph, Ontario, Canada. The modeling algorithms are implemented using open-source software and are tuned to counteract the negative impact on predictive performance resulting from class imbalance common within pipe inspection datasets. The decision tree classifier outperforms SVM for this classification task – achieving an acceptable area under the receiver operating characteristic curve of 0.77 and an overall accuracy of 76% on a stratified test set. Although predicting individual pipe condition is a notoriously difficult task, decision trees are found to be a useful screening tool for planning future inspection-related activities.",DSA,https://www.semanticscholar.org/paper/4fdc4a0147db8d336afd09900191c7d9a6432195,True
Big Data Analytics in Health: an overview and bibliometric study of research activity.,"OBJECTIVE The study presents an overview of the research activity in Big Data Analytics (BDA) in the field of health and demonstrates the existing knowledge through related examples. The objective is to inform health librarians about the nature and magnitude of the technological innovations in health information analysis tools, its influence, and where and how further material could be searched. METHODS We performed a bibliometric and co-citation analysis within a total of 804 papers published between 2000 and 2016 and retrieved from the Web of Science and Scopus databases. Using the NVivo text analysis software, we identified the stakeholders of BDA in health and innovative decision support systems in the field. RESULTS Our findings show a tremendous increase in published papers after 2014. Most of them are relevant to neurology and medical oncology. The stakeholders are clinicians, researchers, patients, administrators, IT specialists, vendors and policymakers. New BDA tools in medicine are mostly developed for disease monitoring purposes while they utilise visualisation to identify disease patterns and statistical analysis of past data for making predictions. CONCLUSIONS Health analytics provide a unique opportunity for advancing health information research and medical decision making. It provides health information professionals with new tools in problem-solving offering new perspectives in prognosis and diagnosis of diseases.",DSA,https://www.semanticscholar.org/paper/5d41cd69b206c0c0080acee446f4abb705105f8e,True
Decision Support Basics,"Because of increasing complexity, rapid change and risk, managers have an obligation to shareholders to learn about and understand computerized decision support systems (DSS). Managers must know much more about information technology solutions and especially computerized decision support. This book is targeted to busy managers and MBA students who need to grasp the basics of computerized decision support. Some of the topics covered include: What is a DSS? What do managers need to know about computerized decision support? And how can managers identify opportunities to create innovative DSS? Overall the book addresses 35 fundamental questions that are relevant to understanding computerized decision support. In a short period of time managers can ""get up to speed"" on decision support, analytics and business intelligence. The book then provides a quick reference to important recurring questions. The questions are arranged in a logical order from more general questions to more specific, including specialized questions of interest to managers and future managers.",DSA,https://www.semanticscholar.org/paper/85cf9b7aa2b2993d8824977c765ea41a600f01af,True
Utility of ChatGPT in Clinical Practice,"ChatGPT is receiving increasing attention and has a variety of application scenarios in clinical practice. In clinical decision support, ChatGPT has been used to generate accurate differential diagnosis lists, support clinical decision-making, optimize clinical decision support, and provide insights for cancer screening decisions. In addition, ChatGPT has been used for intelligent question-answering to provide reliable information about diseases and medical queries. In terms of medical documentation, ChatGPT has proven effective in generating patient clinical letters, radiology reports, medical notes, and discharge summaries, improving efficiency and accuracy for health care providers. Future research directions include real-time monitoring and predictive analytics, precision medicine and personalized treatment, the role of ChatGPT in telemedicine and remote health care, and integration with existing health care systems. Overall, ChatGPT is a valuable tool that complements the expertise of health care providers and improves clinical decision-making and patient care. However, ChatGPT is a double-edged sword. We need to carefully consider and study the benefits and potential dangers of ChatGPT. In this viewpoint, we discuss recent advances in ChatGPT research in clinical practice and suggest possible risks and challenges of using ChatGPT in clinical practice. It will help guide and support future artificial intelligence research similar to ChatGPT in health.",DSA,https://www.semanticscholar.org/paper/003ca99a387b03dacd154b23a0b7f55800bf3aa8,True
Big data and visual analytics in anaesthesia and health care.,"Advances in computer technology, patient monitoring systems, and electronic health record systems have enabled rapid accumulation of patient data in electronic form (i.e. big data). Organizations such as the Anesthesia Quality Institute and Multicenter Perioperative Outcomes Group have spearheaded large-scale efforts to collect anaesthesia big data for outcomes research and quality improvement. Analytics--the systematic use of data combined with quantitative and qualitative analysis to make decisions--can be applied to big data for quality and performance improvements, such as predictive risk assessment, clinical decision support, and resource management. Visual analytics is the science of analytical reasoning facilitated by interactive visual interfaces, and it can facilitate performance of cognitive activities involving big data. Ongoing integration of big data and analytics within anaesthesia and health care will increase demand for anaesthesia professionals who are well versed in both the medical and the information sciences.",DSA,https://www.semanticscholar.org/paper/2c5a1d7cc3078aa958726a82adf2adc6197f1033,True
Schema on read modeling approach as a basis of big data analytics integration in EIS,"ABSTRACT Big Data analysis is the process that can help organizations to make better business decisions. Organizations use data warehouses and business intelligence systems, i.e. enterprise information systems (EISs), to support and improve their decision-making processes. Since the ultimate goal of using EISs and Big Data analytics is the same, a logical task is to enable these systems to work together. In this paper we propose a framework of cooperation of these systems, based on the schema on read modeling approach and data virtualization. The goal of data virtualization process is to hide technical details related to data storage from applications and to display heterogeneous data sources as one integrated data source. We have tested the proposed model in a case study in the transportation domain. The study has shown that the proposed integration model responds flexibly and efficiently to the requirements related to adding new data sources, new data models and new data storage technologies.",DSA,https://www.semanticscholar.org/paper/841cd8e01e7c70a637303e51a5818c917cd5a5ff,True
Addressing the Complexities of Big Data Analytics in Healthcare: The Diabetes Screening Case,"The healthcare industry generates a high throughput of medical, clinical and omics data of varying complexity and features. Clinical decision-support is gaining widespread attention as medical institutions and governing bodies turn towards better management of this data for effective and efficient healthcare delivery and quality assured outcomes. Amass of data across all stages, from disease diagnosis to palliative care, is further indication of the opportunities and challenges to effective data management, analysis, prediction and optimization techniques as parts of knowledge management in clinical environments. Big Data analytics (BDA) presents the potential to advance this industry with reforms in clinical decision-support and translational research. However, adoption of big data analytics has been slow due to complexities posed by the nature of healthcare data. The success of these systems is hard to predict, so further research is needed to provide a robust framework to ensure investment in BDA is justified. In this paper we investigate these complexities from the perspective of updated Information Systems (IS) participation theory. We present a case study on a large diabetes screening project to integrate, converge and derive expedient insights from such an accumulation of data and make recommendations for a successful BDA implementation grounded in a participatory framework and the specificities of big data in healthcare context.",DSA,https://www.semanticscholar.org/paper/81881e0f2e113bd78e0202cff488ae6a6ff35766,True
Modelling road congestion using ontologies for big data analytics in smart cities,"Intelligent Transport Systems are a vital component within Smart Cities but rarely provide the context that is required by the road user or network manager that will help support decision making. Such systems need to be able to collect data from multiple heterogeneous sources and analyse this information, providing it to stakeholders in a timely manner. The focus of this work is to use Big Data analytics to gain knowledge about road accidents, which are a major contributor to non-recurrent congestion. The aim is to develop a model capable of capturing the semantics of road accidents within an ontology. With the support of the ontology, selective dimensions and Big Data sources will be chosen to populate a model of non-recurrent congestion. Initial Big Data analysis will be performed on the data collected from two different sensor types in Greater Manchester, UK to determine whether it is possible to identify clusters based on journey time and traffic volumes.",DSA,https://www.semanticscholar.org/paper/81d8ad14314bf83105a897de6706a38c7c6aac22,True
Health informatics and analytics - building a program to integrate business analytics across clinical and administrative disciplines,"Health care organizations must develop integrated health information systems to respond to the numerous government mandates driving the movement toward reimbursement models emphasizing value-based and accountable care. Success in this transition requires integrated data analytics, supported by the combination of health informatics, interoperability, business process design, and advanced decision support tools. This case study presents the development of a master's level cross- and multidisciplinary informatics program offered through a business school. The program provides students from diverse backgrounds with the knowledge, leadership, and practical application skills of health informatics, information systems, and data analytics that bridge the interests of clinical and nonclinical professionals. This case presents the actions taken and challenges encountered in navigating intra-university politics, specifying curriculum, recruiting the requisite interdisciplinary faculty, innovating the educational format, managing students with diverse educational and professional backgrounds, and balancing multiple accreditation agencies.",DSA,https://www.semanticscholar.org/paper/6b613269aae4d94bdf7ed262d9ed9fb86696215a,True
