Title,Abstract,Subfield,Link,IS_Relevant
E-Government Insights to Smart Cities Research: European Union (EU) Study and the Role of Regulations,"The recent evolution of smart cities research has initiated a holistic dialogue for the integration of past initiatives promoting e-government at European Union Level. At the same moment Future Smart Cities research, is justified as a multi-disciplinary and inter-disciplinary research domain. Within this context this research work provides insights for the integration of Economics, E-government, Information Systems, and Social Sciences. The study addresses the e-government process as one of the most important application of smart cities in our current societies. More specifically, we have examined the existence of $\beta $ -convergence between EU member states in terms of e-government services, confirming the hypothesis that low performance countries record higher growth rate than developed countries. In order to move closer to the factors with high impact on e-government development, we have analyzed other variables for testing the differences between countries, in terms of education, digital skills and access to internet for controlling the hypothesis that countries initially have different development conditions and they will not probably converge to the same steady state. We found that the opportunity of using e-services, particularly e-government services, is less accessible to citizens with low overall digital skills and, as is technically normal, to those with low access to internet access. In this context, at EU level it is needed to rethink and design the e-government services in order to be adapted not only to needs of the citizens, but also to their digital skills. The main contribution of this research is two-fold: From one side provides an integrated study with emphasis on the impact of social sciences and economics research to Future Smart Cities Research and from the other side it brings forward several soft factors for the adoption of Smart Cities services in the context of government transformation and provision of ubiquitous e-services to citizens.",GOV,https://www.semanticscholar.org/paper/6803848fef6400f399e6efb9e7ab50d445da88fc,True
Towards Sustainable Software for Public Sector Information Systems,"One distinctive characteristic of software is its malleability and succeeding opportunity and also need for a constant change. However, in certain types of software, many agencies in the public sector are bound by the laws on competition and financed by governmental budgeting processes. Consequently, the acquiring agencies adapt their processes to what the existing systems allow due to complexities in making changes and modifications. In this paper, we study the relation of public sector software acquisition and delivery, and the continuously changing nature of software. Then, we analyse pain points of evolving software in public sector information systems, and propose technical artefacts to improve the status quo. Finally, to add flexibility to public sector information systems’ acquisition and evolution, we elaborate a novel architectural pattern called Mosaic architecture, based on macroservices, which allows independent subcontracting, development, and deployment. The approach is demonstrated with a real-world industrial study from a public service that has been sketched applying the macroservice principles.",GOV,https://www.semanticscholar.org/paper/262e04342cd0457617bdb9e091820e1a65fe6ffb,True
DeLone and McLean’s reformulated information systems success model: a systematic review of available literature in public sector (2011-2022),"Purpose DeLone and McLean (D&M) has been amongst the most widely used models to assess the success elements of information systems (IS) since 1992. A decade later in 2003, D&M proposed a revised design that included several components which have been left out of original proposed model. This study aims to rely on the review of a number of papers casing the era 2011–2022 that satisfies a specific set of requirements to identify the research gaps in this area and to prepare a future research agenda. Design/methodology/approach This study is a systematic review: a technique that identifies and evaluates pertinent research. This gathers and analyses data from selected studies with objective to catalogue all empirical research studies, which responds to a certain study topic or hypothesis to meets predetermined inclusion criteria. Data collection method was divided into four stages, and selection details are determined through flow chart. Findings This research discovered D&M 2003 model use in many contexts, countries and cultures to better comprehend the topic and addresses its gaps, particularly with regard to public sector and its particularities. Publications have frequently emphasized the significance of this idea while studying public sector information systems by using associated variables-related items. Findings also include a summary of key components and dimensions used in reviewed studies in relation to each of the seven variables, and associated particularities in government sector over the world. Originality/value To the best of the authors’ knowledge, this is the first ever effort in this developing country in discipline of Information Management to execute such kind of study to review D&M ISS model in detail at this stage to evaluate nonacademic public sector information systems around the world.",GOV,https://www.semanticscholar.org/paper/a3919afe0c2d93b9b9b466e3c6b82f2f881da8e7,True
Development of public sector information management systems: challenges and promising practices,"Purpose More and more governmental organizations are switching to information systems to enhance their operations and reduce cost but the development of these systems involves a lot of challenges. This paper aims to find out the challenges that project managers have to face during the development of such systems and the practices they can adopt to address these challenges. Design/methodology/approach To identify the challenges, data have been gathered across six key project management areas. The six targeted key areas are project integration management, project scope management, project time management, project cost management, project human resource management and project communications management. The authors have coordinated with 11 managerial-level IT professionals using semi-structured interviews and have gone through their communication archives. Findings Findings prove that practices such as focusing on cost reduction, informal congregations, trainings and frequent communication between vendor and client help in addressing the challenges. Furthermore, learning from management experiences of the managers can assist managers in similar role to create a pattern of success while working with governmental projects. Originality/value The authors peek into the development life cycle of a public sector project named as prison information management system. The project has encountered numerous challenges and has been accomplished in significantly delayed time than designated.",GOV,https://www.semanticscholar.org/paper/a13e844549b5437d3207ba0444b40c8deedcf1d7,True
Evaluating Public Sector Information Systems: More Than Meets the Eye,"mation systems. T he proliferation of personal computers, networked terminals, and powerful workstations throughout the public sector makes information systems and their information products readily accessible to most government workers. In many cases, the use of information systems seems indispensable for public program success in service delivery, oversight, policy formulation, and accountability functions. The knowledge and skills for effective evaluation of these crucial information systems are not nearly as pervasive as the systems or the range of users. Guidance on effective information-system evaluation is not even readily available for private-sector evaluators, and the governmental environment presents different sorts of challenges for those intent on ensuring effective evaluation.",GOV,https://www.semanticscholar.org/paper/2c6597b462f2691711fd9faaf4d5f918b1e85827,True
The impact of public sector scorecard adoption on the effectiveness of accounting information systems towards the sustainable performance in public sector,"Abstract The effectiveness of accounting information system (AIS) in public sector organization (PSO) is well recognized to play an important part in obtaining sustainable performance (SP). Nevertheless, the effectiveness of AIS cannot achieve the SP on its own due to the rapid changing in the global economic world. Accordingly, there is an increasing demand on a framework of evaluation which is considered to be appropriate with the characteristics of PSO to orientate, manage, and assess operations of AIS toward attaining SP. Thus, this study is undertaken with the aim at exploring the relationship between the impact of public sector scorecard (PSS) implementations and effectiveness of AIS toward SP enhancement with evidence gathered from 883 PSOs’ accountants in Mekong Delta region. Data analyzed by the Structural Equation Modeling (SEM) highlight that PSS adoption has a significant impact on the effectiveness of AIS. It also provides a reliable basis for the association between the effectiveness of AIS and SP. Although the topic of research is still immature, these findings are predicted to serve as a catalyst for scholars, practitioners, and policymakers to inquire and adopt because of its potential benefits in PSOs’ operations.",GOV,https://www.semanticscholar.org/paper/8187ddda8a5551b5b9896b749f35751d48e8e645,True
Successful Implementation of Information Systems in Public Sector Organizations,"This study aims to determine the success of the implementation of the Regional Financial Management Information System (SIPKD) in the Regional Work Unit (SIPKD) in the Sumedang District Government, by examining the effect of system quality, information quality and service quality on user satisfaction and its implications for net benefits. This study uses primary data from questionnaires given to leaders of agencies, operators, and administrators of SIPKD. The data analysis method used is path analysis. The results of this study indicate that the quality of the system, the quality of information, and the quality of service affect user satisfaction and impact on net benefits both partially and simultaneously. The results of this study contribute to adding literature on the implementation of information systems in public sector organizations, and influencing factors can be used as a reference for public sector organizations in assessing the application of information systems.",GOV,https://www.semanticscholar.org/paper/ec201270a6a66e8ae2a24f678e09eba123dd499f,True
A Synthesis on SWOT Analysis of Public Sector Healthcare Knowledge Management Information Systems in Pakistan,"Healthcare is a community service sector and has been delivering its services for the betterment of civic health since its establishment at communal level. For working efficiently and effectively, this sector profoundly relies on correct and complete health information of people and a proficient integrated healthcare knowledge management information system (HKMIS) to manage this information. The performance of Healthcare organizations has significantly augmented by inception of Information and Communications Technology (ICT) in HKMIS in developed countries, but is yet to exhibit its full potential in developing countries specifically those with huge populations like Pakistan. An exploratory qualitative research methodology was adopted to conduct this study. The purpose and objective of this study was to determine and investigate the internal and external factors that influence the performance of HKMIS by performing SWOT analysis on two of the largest public-sector healthcare organizations of Pakistan. The findings of this study will certainly help authorities to devise methods of improvement in Pakistani HKMIS eventually paving ways towards a better and improved healthcare in the future.",GOV,https://www.semanticscholar.org/paper/3f7c41e7c5babdc8bba7f6eca8c3ed76bac17a28,True
The Impact of Human Resource Information Systems: An Exploratory Study in the Public Sector,"Various authors have advocated that the use of a Human Resource Information System (HRIS) should lead to valuable outcomes for the organization. Decreased costs, improved communication, and decreases in time spent on mundane activities should create an environment wherein the Human Resources (HR) department would play a more strategic role in the organization. This study is an initial attempt to determine whether HRIS has reached these potential benefits. Based on responses from a sample of HR directors of from public universities we found that, while valuable, HRIS has not yet reached its full potential in this environment.",GOV,https://www.semanticscholar.org/paper/c0fc0185e46672a97384698a2d90250240e3d7d2,True
Public-sector Financial Management and E-government: The Role Played by Accounting Systems,"ABSTRACT The paper investigates the relationship between two central features of public-sector financial management reforms: accounting innovations and e-government. It focuses on the quality and ease of access to information provided by different accounting systems and e-government strategies. Based on a sample of 33 Organization for Economic Cooperation and Development (OECD) countries, the findings underscore the need to adopt a holistic perspective that considers not only technological issues but also the quality and integrity of information, its international comparability, and the socioeconomic context. The results suggest that both technical and social factors should be considered in adopting e-government.",GOV,https://www.semanticscholar.org/paper/a04b9b4aac97298bb3277492e67e63ec1c9d6f64,False
Value–Based Guiding Principles for Managing Cognitive Computing Systems in the Public Sector,"Abstract Cognitive Computing Systems (CCSs) are increasing in prominence in the public sector. This paper develops a framework drawing on public value and information technology service management literature to guide the management of CCSs in the public sector. We draw on academic literature, gray literature, legislation and government reports, and examples on CCS initiatives in the public sector to develop insights for research and practice. We then outline the themes and present the insights in the form of guiding principles and specific (detailed) recommendations. These include guiding principles and recommendations for establishing legitimacy, understanding the required capabilities, executing capabilities, creating and measuring public value.",GOV,https://www.semanticscholar.org/paper/d82085d4c4b3c82914c5d0b2084b37a90e79bc8d,True
The role of data and information security governance in protecting public sector data and information assets in national government in South Africa,"Background: The deployment of information and communications technology (ICT) in the public sector, has been exposed to increasing security breaches and cyber-related crimes that have resulted in unauthorised access, theft, fraud and misuse of highly confidential, classified and sensitive public sector data and information (PSDI) assets. The government, as one of the biggest collectors and distributors of PSDI assets, needs to be constantly aware of the risks associated with the collection, classification, storage and dissemination of critical PSDI assets. The lack of sufficient data and information security measures could pose significant security risks that could impact on state security, thus causing national working relationships to be strained, which presents gaps and opportunities for external intruders to capitalise on the mistrust of the government to infiltrate further attacks on critical Information Technology (IT) infrastructure and systems. In order to mitigate and counteract critical and sensitive data and information-related crimes, the government must understand and analyse the importance of data and information security governance (DISG) and how it should be institutionalised through an integrated approach to improve and protect PSDI assets. Aim: The aim of this article is to analyse the institutionalisation of DISG measures government has implemented towards the protection of PSDI assets. Setting: The research setting is in three national government departments, namely the Department of Energy (DoE), the Department of Environmental Affairs (DEA) and the Department of Science and Technology (DST). This study investigates how the strategic combination of data governance (DG) and information security governance (ISG) practices and principles could be implemented and incorporated as one of the various approaches in public sector institutions to improve the DISG management functions of an organisation’s overall data and information systems and processes. Methods: The research approach is qualitative, and the research methodology includes a multiple case study design. Data were collected through semi-structured interviews and was triangulated with literature review. Primary data was analysed using thematic analysis. Results: The research findings are presented according to the McKinsey 7S model, which served as the analytical framework in the study. The research findings indicate that the institutionalisation of DISG management practices and functions in the South African public sector context are very limited, and there is a dominant focus on IT and IT security. It was also identified that DISG policies, practices, and systems have been found to be lacking in public sector management and governance functions. Conclusion: The study concludes that there is currently a lack of sufficient DISG policies, management practices and systems, particularly in the national sphere of government.",GOV,https://www.semanticscholar.org/paper/0f5b408625d260125b7fbb2d51417ea7a1991bec,True
A Framework for the Adoption of Blockchain-Based e-Procurement Systems in the Public Sector,"Public procurement constitutes a core government function for providing goods and services to citizens. The overall success of a digitized public-procurement function yields progress and economic growth for the nation. In this research, we analyze the potential of blockchain-based systems to enhance effectiveness, ease, and transparency in public procurement in the case of Nigeria and identify the current challenges facing public procurement, i.e., lack of trust and transparency among critical stakeholders in the procurement process, systems that only weakly support transaction recording and documentation, complex process structures, corruption in institutions involved in the procurement process. To address these issues, a blockchain-based framework is developed to enable interoperability of information-systems involved in the procurement process, increase citizen participation in eliciting project requirements and to enable a more transparent project monitoring and auditing. We apply the framework to a case study with respect to identifying on-chain activities that enable system interoperability, e-participation and project auditability.",GOV,https://www.semanticscholar.org/paper/6a6c50c74125765f68e32f56a771c1188148eb38,True
Critical Success Factors Affecting Information System Satisfaction in Public Sector Organizations: A Perspective on the Mediating Role of Information Quality,"Many studies have investigated technology adoption in western countries and ignored the Arab region. The available Arab studies focused on the technology adoption model (TAM) and its subsequent variations while leaving important factors such as information quality, user involvement, availability of training and top management support on the success of information systems (IS). Despite that these factors were studied scantly in some past studies, this research attempts to fill this gap and develop a more integrative model of IS success. Results indicated the existence of four critical success factors, three organizational factors (management support, training, user involvement), and an information system factor (information quality), that affect IS success (use and satisfaction). Results found that information quality for the first time mediates the effect of the three organizational factors on IS success, while TAM components (perceived usefulness and perceived ease of use) have no effect.",GOV,https://www.semanticscholar.org/paper/dafc900f1ed0a345772335b7c396b868238ad7ef,True
How is the Use of Performance Information Related to Performance of Public Sector Professionals? Evidence from the Field of Academic Research,"ABSTRACT There is inconclusive evidence as to how performance management is actually related to performance, particularly in subfields of the public sector where professional work prevails. We propose that the association between the use of performance information and performance of public sector professionals varies with the targets of management control. We test our hypotheses in the field of academic research, a prime example of professionalism in the public sector. The overall results of an online survey with 1,976 observations suggest that performance management is positively related to publication performance when performance information is used for the control of input targets. In contrast, we find negative associations of performance information with performance when used to control output targets. Public managers in professional fields should consider these countervailing relationships when they compose and use control systems.",GOV,https://www.semanticscholar.org/paper/6123a5b7de12704b080a6cc34bb829aed4eb3921,True
Big Data in Health Information Systems,"In the healthcare sector, Information Systems are fundamental for decision-making at all levels. This process can be strengthened with the implementation of Big Data analytics. In this context, the present study aims to describe the experiences, benefits, and applications of Big Data in Health Information Systems through a systematic literature review. The research reviewed 22 studies on the use of Big Data in the healthcare sector, applying inclusion and exclusion criteria to select relevant studies. The results of these studies indicated that the use of Big Data in healthcare can improve the quality of teleassistance services for patients, as well as logistics and financial services. It can also prevent diseases and improve patient care in public health information systems. Additionally, it can provide new knowledge and actionable information from new data sources, and promote the natural transformation of descriptive research into predictive and prescriptive research. The studies also highlighted the importance of Artificial Intelligence for data to be useful for research and medical purposes. In general, the research concluded that Big Data has a favorable impact on the healthcare sector, especially in biomedical research, and that its use can improve the efficiency and quality of medical care.",GOV,https://www.semanticscholar.org/paper/00e16a22adb5819a25f4aaed452547dd6620df19,True
Information technology systems in public sector health facilities in developing countries: the case of South Africa,"BackgroundThe public healthcare sector in developing countries faces many challenges including weak healthcare systems and under-resourced facilities that deliver poor outcomes relative to total healthcare expenditure. Global references demonstrate that information technology has the ability to assist in this regard through the automation of processes, thus reducing the inefficiencies of manually driven processes and lowering transaction costs. This study examines the impact of hospital information systems implementation on service delivery, user adoption and organisational culture within two hospital settings in South Africa.MethodsNinety-four interviews with doctors, nurses and hospital administrators were conducted in two public sector tertiary healthcare facilities (in two provinces) to record end-user perceptions. Structured questionnaires were used to conduct the interviews with both qualitative and quantitative information.ResultsNoteworthy differences were observed among the three sample groups of doctors, nurses and administrators as well as between our two hospital groups. The impact of automation in terms of cost and strategic value in public sector hospitals is shown to have yielded positive outcomes with regard to patient experience, hospital staff workflow enhancements, and overall morale in the workplace.ConclusionThe research provides insight into the reasons for investing in system automation, the associated outcomes, and organisational factors that impact the successful adoption of IT systems. In addition, it finds that sustainable success in these initiatives is as much a function of the technology as it is of the change management function that must accompany the system implementation.",GOV,https://www.semanticscholar.org/paper/18fe406a435037484cddad04f3a3baaa7af36b50,True
