Title,Abstract,Subfield,Link,IS_Relevant
"The Past, Present, and Future of Enterprise Resource Planning","Enterprise Resource Planning (ERP) is a software system designed to facilitate the automation and management of essential business operations inside businesses, with the aim of achieving optimum performance. ERP software facilitates the integration and synchronization of data across various business processes inside an organization. This results in the establishment of a unified and reliable source of information, which in turn optimizes the efficiency and effectiveness of operations throughout the whole firm. The platform has the capability to integrate a company's human resource functions, financials, manufacturing, supply chain, operations, reporting and commerce into a unified system. The objective of this article is to provide a comprehensive examination of the historical progression and evolution of ERP systems, while also highlighting contemporary advancements facilitated by digital breakthroughs such as cloud computing. The research methodology used in this work included doing a comprehensive evaluation of scholarly literature sourced from academic publications as well as industry sources. The study revealed that ERP systems have undergone significant transformations compared to their predecessors, like MRP (material resource mapping) systems and IC (integrated control) packages. The ongoing transformations are seen in conjunction with the emergence of cloud computing and advancements in modern technologies such as artificial intelligence. Numerous scholarly publications have already examined the progression of Enterprise Resource Planning (ERPs). However, the distinctive value of this particular article lies in its comprehensive coverage of the latest advancements in the field, including debates on cloud-based ERPs and postmodern ERPs.",ENT,https://www.semanticscholar.org/paper/8d37fe6ac2ff38c63893d2d0343f5b3901271574,True
User Acceptance of Enterprise Resource Planning (ERP) Systems in Higher Education Institutions: A Conceptual Model,"It has become common practice for higher education institutions (HEIs) to replace existing computer systems, called legacy administrative information systems, with new ones to cope with the continuously changing demands in the context of education. At the top of these systems is enterprise resource planning (ERP) systems that integrate HEIs' business processes, functions, and data to improve their overall productivity and effectiveness. However, many studies on ERP adoption have shown that organizations frequently face several barriers, and the failure rate is high. In addition, various research projects have concluded that, quite often, HEIs do not obtain the expected advantages from the adoption of the ERP system. This research aims to explore the factors that affect the behavioral adoption and acceptance of an ERP system in the context of HEIs. Based on works from literature and authors' observations of the PeopleSoft system (ERP system) implementation at Yanbu University College (YUC) in Yanbu City, Saudi Arabia (SA), a conceptual model of users' acceptance of ERP systems has been proposed. The framework is based on the unified theory of acceptance and use of technology (UTAUT) model and is extended with additional constructs. The present study offers a theoretical contribution by extending the UTAUT model to provide a richer understanding of users' adoption behavior of ERP systems in the HEI context. In addition, according to the authors' knowledge, this is the first paper that to address ERP users' adoption perspective in HEIs in SA.",ENT,https://www.semanticscholar.org/paper/8440cdc487fa0ab3fcc92c8b4e7d96d7be0a1738,True
Factors of Success in Implementation of Enterprise Resource Planning Systems,"Implementing complex and yet sound and effective accounting information systems known as enterprise resource planning systems, is an enormous project for the firms that want to streamline their information flow and increase their value. As the effects of these systems on the performance of the entities are both financial and non-financial, their success is of crucial importance. This study is an exploratory factorial analysis to identify the factors of successful implementation of ERP systems in the medium and big companies in Albania. We use in depth surveys and interviews with firms that have implemented enterprise resource planning systems and include twenty initial variables in the survey. Later these variables are combined in three factors that have the biggest impact on the success rate of ERP implementation: the overall quality and end-user satisfaction with the ERP system; the cost-benefit ratio of the ERP and the support from the ERP provider and ERP implementing consultant. This study contributes not only theoretically to the empirical literature, but also practically because it helps businesses of the region that are considering implementing ERPs in the future to pay attention to the most critical factors of success with ERPs.",ENT,https://www.semanticscholar.org/paper/a342b26e0aeded384d2cffd358e670346103ed28,True
Managing Records in Enterprise Resource Planning Systems,"Enterprise resource planning (ERP) systems are increasingly being used for the management of business processes and to integrate tasks within institutions in real time. While managing and integrating processes, ERP systems generate and are expected to manage enormous amounts of data and information that should be managed in trustworthy manner. This article draws from a multi-year ERP implementation project by the United Nations to highlight some recordkeeping challenges.",ENT,https://www.semanticscholar.org/paper/9141e457a8432676e611a011dcd66dbf7ce1668f,True
Sustainable Construction through Resource Planning Systems Incorporation into Building Information Modelling,"The latest industrial revolution 4 enabled significant performance improvement through technological advancements. Simultaneously, the industry is setting high-level expectations for changing business practices toward long-term benefits in all three sustainability dimensions. The concept of sustainability embraces all production and operation processes in the Architecture, Engineering, and Construction (AEC) industry. This study systematically explores the literature on sustainability with Enterprise Resource Planning (ERP) and Building Information Modelling (BIM) technologies in the AEC industry and the sustainability vision for their integration. The different types of ERP and BIM implementations have similarities in addressing the broad scope of functionalities. The emergence and proliferation of ERP and BIM have brought crucial changes to the business environment. Further evolution to cloud-based operations is transforming companies from technology-oriented practices to data-centric decision-making smart infrastructures. The narrative literature review investigates the sustainability insights and ideas in ERP and BIM solutions, presenting state of the art on systems integration topics. The relevant literature was retrieved to achieve the research objectives which were qualitatively analyzed to generate the basis for further research.",ENT,https://www.semanticscholar.org/paper/d2183b0a9e235c11a36db450e2fed432025e1b8a,True
Enterprise Resource Planning Systems: The Business Backbone,"Enterprise Resource Planning is a software system that integrates data and information management of the entire functional company that includes finance, accounting, production, sales, purchasing, human resources and other functions. These functions are separated by software modules, but are connected to one integrated data center. Modules in the ERP system include financial accounting, control, investment management, enterprise controlling, treasury, logistics execution, sales distribution, materials management, production planning, plant maintenance, quality management, project systems. The benefits of ERP in the company can help business process automation, Single point of information, High efficiency, Sources of information sufficient to conduct analysis.",ENT,https://www.semanticscholar.org/paper/4081b8aac8c6036a5363615bf22eff04aee3a2d0,True
Enterprise Resource Planning Systems and XBRL Reporting Quality,"Enterprise resource planning (ERP) systems are indispensable for a majority of larger and midsize firms, and have changed the way accounting information is collected, stored, processed, and disseminated. Although most ERP systems integrate an eXtensible Business Reporting Language (XBRL) component in their core modules, little research has examined how ERP systems affect the quality of XBRL filings. Using unique data from branch-level ERP implementation, we find that the degree of ERP adoption among a firm’s branches is negatively associated with the firm’s XBRL filing errors and positively associated with XBRL reporting comparability, which in turn facilitates external users’ access to the firm’s XBRL filings in the SEC’s EDGAR. These results suggest that ERP systems improve XBRL reporting quality. Moreover, our results indicate that ERP can mitigate the negative effect of extension taxonomies on XBRL reporting quality, which highlights the importance of the ERP system in a complicated XBRL reporting environment.",ENT,https://www.semanticscholar.org/paper/9db246f49f59fd858598c13e5331edec32d6e3e6,True
Factors affecting post-implementation success of enterprise resource planning systems: a perspective of business process performance,"ABSTRACT The study investigates critical factors which are important to evaluate enterprise resource planning (ERP) in the post-implementation stage. A conceptual framework is proposed with a set of relevant hypotheses and a structural equation modeling is used to analyze the survey data using Smart-PLS package program. The results illustrate that post-implementation success factors are significant for assessing an overall impact of ERP post-implementation. Likewise, the possibility of business process performance is higher in a condition of when the systems are employed in a coordinated way. The findings may assist ERP professionals and developers in other countries for ERP implementation in future.",ENT,https://www.semanticscholar.org/paper/102eb7844bf134b973c4441955b07b5a191fba28,True
Developing an ARIS-House-Based Method from Existing Information Systems to Project-Based Enterprise Resource Planning for General Contractor,"In recent years, general contractors in the construction industry have gradually begun to implement a system called enterprise resource planning (ERP). During the ERP implementation process, contractors performed required analyses on daily operation functions demanded by the enterprise. The analyses focused on function mapping to ensure that ERP satisfies all the requirements, including the functions of existing information systems, and meets future requirements. The process of function mapping in the construction industry typically involves a series of lengthy and time-consuming meetings, and face-to-face discussions; systematic analysis procedure was lacking. This research will propose a novel function mapping approach, the Architecture of Integrated Information Systems (ARIS)-house-based (AHB) method, to enhance the effectiveness of meetings and improve the efficiency of discussions. In addition, AHB method will use the structure of ARIS-house diagram to guide the function mapping process, streamline existing information systems, meet future requirements, and successfully implement ERP. Finally, this research will use a case study to verify the effectiveness of the AHB method for contractor to implement ERP.",ENT,https://www.semanticscholar.org/paper/c7ada5c39a84a5e0f893d9f96ab1dadb263d2ab5,True
Environmental information systems based on enterprise resource planning,"This paper describes the consequences of the integration of environmental information within enterprise resource planning (ERP) systems. The state‐of‐the art of dedicated environmental information systems is briefly discussed. Essentials and peculiarities of environmental information are highlighted. The role of environmental management systems and their relationship with other dedicated management systems is positioned within this field. The need for information following from this is compared with the information available in current ERP systems. The common features of both information systems are discussed and the importance of physical relationships within them is demonstrated. A physical approach is argued as the very base of future extended ERP systems. An outline of the special character of physical information is presented for this purpose. Subsequently, some restrictions connected to the current approach in ERP are analysed. This results in a number of recommendations. The most crucial aspects are the integration of the process and discrete manufacturing orientation by applying a multiple‐input multiple‐output approach to all processes, and a similar consideration of co‐products, by‐products, wastes and emissions.",ENT,https://www.semanticscholar.org/paper/c384c60789fc77df58c033b7bc1492c9dcf5d108,True
Quality And Effectiveness Of Enterprise Resource Planning - Customer Relationship Management Systems: Implications For Information Systems Marketing Strategies,"The present research examines the success of Enterprise Resource Planning (ERP) systems in Greece, employing Delone and McLean’s model. The questionnaires of the study were e-mailed to the 1,049 largest organizations based on turnover and assets. The final research sample consists of 105 Greek enterprises. The list of organizations was compiled by using the Index of Companies and Products Directory (ICAP). Results show that users have more positive attitude towards system quality and information quality and less positive attitude towards service quality. Moreover, users believe that ERP systems enhance their performance and can contribute to the control of management. Furthermore, present paper proved that D&M model constitutes a causal model with the exception of the variable of system use that is only related to user satisfaction, and ERP system quality.The findings of this research trigger many theoretical and managerial implications and create lots of potential for future research in the fields of Information Systems, Management, and Marketing.",ENT,https://www.semanticscholar.org/paper/cdf1e40e9d4fa057393f6a486bdeffcbefc46e1b,True
Impact of Top Management Support on Accounting Information System: A Case of Enterprise Resource Planning (ERP) System,"Accounting Information System (AIS) is a system that processes financial and nonfinancial transactions that directly affect the organizations operations processing of financial activities such as changes to customers' names and addresses to keep such files current. The purpose of this study was to illustrate the impact of top management support on accounting information systems, a case of Enterprise Resource Planning (ERP) Systems and, further, to analyze the impact of accounting information systems on organizational performance. Online questionnaire was the main tool used for data collection and data was analyzed using descriptive statistics, inferential statistics, as well as while qualitative data was analyzed using thematic analysis. The study established that in the 3 university ERP had already been adopted and was being implemented. Also the Top Management supported the implementation of ERP. The ERP system was not adequately utilized to realize its full potential. It was extensively used on matters related to finance. Especially students finance and managing of the universities payrolls. The systems had not yet been extensively used on managing human resource matters and communication that it had capacity to achieve much. The findings of this study are important as they provide insight that could awaken the institutions that had adopted the ERP systems on how they could optimally benefit from the system. It also highlights the role played by top management on implementation of a new system like ERP. Finally it gives knowledge for fellow scholars interested in the field of Accounting Information Systems generally.",ENT,https://www.semanticscholar.org/paper/1c8da87398d55fd072df819ad144073a0951ccae,True
Extended Version of Linguistic Picture Fuzzy TOPSIS Method and Its Applications in Enterprise Resource Planning Systems,"The main objective of the proposed research in this paper is introducing an extended version of the linguistic picture fuzzy TOPSIS technique and then solving the problems in enterprise resource planning systems. In this article, we use the uncertain information in terms of linguistic picture fuzzy numbers; the decision maker provides membership, neutral, and nonmembership fuzzy linguistic terms to represent uncertain assessments information of alternatives in linguistic multicriteria decision making (LMCDMs). In order to introduce the extended version of TOPSIS method, we defined a new hamming distance measure between two linguistic picture fuzzy numbers. Further, we apply the proposed method to problem of enterprise resource planning systems and discuss numerical implementation of the proposed method of LMCDM.",ENT,https://www.semanticscholar.org/paper/e4988b0367cff825d0f69cb9c3fce8fc7ac67add,True
A structural equation model for analyzing the relationship between enterprise resource planning and digital supply chain management,"Digitization and the internet are new phenomena which have greatly changed the way in which modern-day businesses are run. Enterprise resource planning (ERP) is one such system developed as a result of digitization in order to improve firm supply chain efficiency. This study investigated the relationship between digital and sustainable supply chain (in this case the ERP system) and firm competences of supply chain management. 33 respondents from e-commerce firms volunteered to take part in the data collection process of the study, with a majority of them being information technology (IT) managers. The hypothesized relationships were analyzed using structural equation modelling (SEM). Findings of the study depict that all the hypothesized relationships were significant (p<.001) at the 1 % level of significance, implying that there exists a positive effect of the ERP systems on firm performance.",ENT,https://www.semanticscholar.org/paper/12f6dfcba6462ce45a763092db6ecd9d301dac3f,True
A decision-making framework for evaluating enterprise resource planning systems in a high-tech industry,"ABSTRACT In recent years, the adoption of enterprise resource planning (ERP) is becoming essential for achieving fast and transparent information exchange, avoiding unnecessary waste and maintaining coordination within a firm and among partners in a supply chain. However, the implementation of an ERP system often fails, and one major reason is that the selected ERP system is not suitable for the firm. Therefore, a good evaluation framework for selecting the most appropriate ERP system is necessary. This study proposes a framework, which integrates decision-making trial and evaluation laboratory (DEMATEL), analytic network process (ANP), VlseKriterijumska Optimizacija I Kompromisno Resenje in Serbian (VIKOR) and fuzzy set theory, for the evaluation of ERP systems. First, the fuzzy DEMATEL is used to understand the direct and indirect relationships among the criteria. Second, the fuzzy ANP is adopted to calculate the importance weights of the sub-criteria. Finally, the most appropriate ERP system is obtained by the fuzzy VIKOR. The proposed decision-making framework is applied to a firm in the high-tech industry in selecting the most appropriate ERP system. The results show that the proposed framework can help firms evaluate ERP systems effectively by collecting experts’ opinions in an uncertain environment.",ENT,https://www.semanticscholar.org/paper/2a4015f9b23031624ba0dc592bb888aff85ce4ac,True
Enterprise Resource Planning Systems: Digitization of Healthcare Service Quality,"The purpose of this study is to evaluate the perception of healthcare professionals in improving the quality of services in healthcare centers by deploying the platform of Enterprise Resource Planning (ERP). Individual attributes, organizational impression, information, and the system quality of ERP have been used to evaluate the overall influence of integrated planning systems on health care service quality. A mixed methods approach is used to collect and examine data through triangulation. Data for the empirical study was collected from 279 medical professionals of five healthcare organizations operating in the city of Lahore, Pakistan, through a self-administered questionnaire. Descriptive statistics squared multiple correlations and reliability coefficients were used as data analysis tools. Moreover, the goodness of fit test of the structural model was conducted through AMOS 20. All given dimensions of ERP are postulated to have a positive effect on healthcare service quality. The results reveal that the use of an enterprise planning system has a positive impact on individuals, organizational information quality, and system quality in healthcare services. The study further concludes that a well implemented ‘Enterprise Resource Planning System’ results in better system output and enables healthcare professionals to provide better healthcare service quality.",ENT,https://www.semanticscholar.org/paper/5b017a61c6f37303e2a4684808c108644ea71b7b,True
Effect of Enterprise Resource Planning Systems and Forms of Management Control on Firm’s Competitive Advantage,"In the brick of digitalization industry revolution era, this study signifies the pertinent role of Enterprise Resource Planning Systems (ERPs) towards assisting the organization towards attaining the firm’s mission and goal. This study extends the knowledge by exploring the relationship between ERPs and management control (MC), which in turn enhances firm’s competitive advantage. Realizing the limited empirical work on ERPs from management accounting and control perspective, the discussion would be drawn from business stakeholder’s perspective, instead of from information technology standpoint. The study views ERPs as an important resource in creating the capability to control the business operations and combination of both factors creates the firm’s competitive advantage. Survey questionnaires were administered via email to 972 randomly selected manufacturing firms listed in Federation of Malaysian Manufacturer Directory. Based on the 114 usable responses, the data was analyzed using a structural equation modeling (SEM) approach through partial least square (PLS) software. The findings provide empirical evidence on the significance of ERPs in determining firm’s MC approaches, both technocratic and socio-ideological forms of control. Evidently, these variables do associate positively with competitive advantage. Additionally, the analysis demonstrates that only technocratic form of MC mediates the relationship between ERPs and competitive advantage, but not for socio-ideological control. These findings provide an insight on the relationship among ERPs, form of MC and firm’s competitive advantage, which may be an input for businesses in facing the industrial digitalization era.",ENT,https://www.semanticscholar.org/paper/bc64add806952d12ccae223aa233c31bd5d545b4,True
Optimization of Resource Allocation and Task Allocation with Project Management Information Systems in Information Technology Companies,"This study proposes a novel approach to designing an integrated Resource Allocation and Task Allocation Optimization System (RATAOS) using Enterprise Architecture (EA) to improve project management efficiency. The proposed approach integrates Project Management Information System (PMIS) with an optimization system designed using a random forest model and Natural Language Programming (NLP). The integrated system optimizes resource and task allocation, reducing operational costs by 14% and planning phases by 88.7%. Project completion time increased by 50.80%, demonstrating the effectiveness of the integrated system. The purpose of this study is to find a solution for PMIS to be used as an automatic data-driven Resource and Task Allocation Optimization System. The technique used in this study is service integration between the existing PMIS with the Resource and Task Allocation Optimization System.",ENT,https://www.semanticscholar.org/paper/899615d43bfd84a14ab660f16d11d243fa9f6200,True
Conceptual model of enterprise resource planning and business intelligence systems usage,"Businesses have invested considerable resources in the usage of enterprise resource planning ERP and business intelligence BI systems. These systems were heavily studied in developed countries while there are a few and narrowly focused studies in developing ones. However, studies on the integration of ERP and BI have not been given enough attention hereafter ERPBI. There are many challenges facing the ERPBI usage in term of the steadily increasing speed with which new technologies are evolving. In addition, there are a number of factors that affecting this usage. Based on the finding of the literature, a model from a critical success factors CSFs perspective that examine the relationship between ERPBI usage and organisational performance is proposed. The conceptual model provides a foundation for more research in the future. The expected results of the study will improve the business outcome and help design strategies based on an investigation between ERPBI usage and organisational performance.",ENT,https://www.semanticscholar.org/paper/4f5051cadf136ab08953ef987c83c17019b99343,True
